,contact_address1,contact_address2,contact_city_state_zip,contact_email,contact_phone,contact_title,details_url,program_description,program_name
0,,,,,,,https://www.scholarships.com/financial-aid/college-scholarships/scholarships-by-major/math-scholarships/woodrow-wilson-teaching-fellowship/,"The Woodrow Wilson Teaching Fellowship program recruits and trains the nation's best and brightest recent graduates and career changers with STEM backgrounds to teach in high-needs middle and high school science and math classrooms.(adsbygoogle = window.adsbygoogle || []).push({});The Teaching Fellowship includes:- admission to a master's degree program at a well-established partner university- teacher certification in science, mathematics or technology education- extensive preparation for teaching in a high-need urban or rural secondary school for one full year prior to becoming the teacher-of-record in a science or math classroom- a $30,000 stipend (Once Fellows are certified teachers at the end of the first year, they obtain salaried employment in high-need schools.)- support and mentoring throughout the three-year teaching commitment- support of a cohort of WW Fellows passionate about science and math education- lifelong membership in a national network of Woodrow Wilson Fellows who are intellectual leadersThe Fellowship is open to college seniors, graduates, and career changers who:- have majored in and/or have a strong professional background in a STEM field (science, technology, engineering, or math);- demonstrate a commitment to the program and its goals;-  have U.S. citizenship or permanent residency;-  have attained, or expect to attain by June 30, this upcoming year, a bachelor's degree from an accredited U.S. college or university or its international equivalent (Note: Undergraduate degrees earned outside the U.S. are accepted if an approved credential evaluator declares the degree equivalent to an earned U.S. bachelor’s degree.);- a cumulative undergraduate grade point average (GPA) of 3.0 or better on a 4.0 scale is preferred (Note: Candidates who can demonstrate excellence through other avenues will also be considered. All applications are considered in their entirety and selection is based on merit.)To learn more and apply, check out our website.",Woodrow Wilson Teaching Fellowship
0,204 E Street NE,,"Washington, DC 20002",info@womeninaerospacefoundation.org,,,https://www.scholarships.com/financial-aid/college-scholarships/scholarships-by-major/math-scholarships/women-in-aerospace-foundation-scholarship/,"The WIA Foundation is pleased to provide scholarships to women interested in a career in the aerospace field to pursue higher education degrees in engineering, math or science. One or more awards will be given each year to a rising junior or senior in college, to be applied during the upcoming academic year. Applicants must have completed at least 2 ½ academic years of full-time college work at the time of application and be currently enrolled at an accredited college or university. For more information or to apply, please visit the scholarship provider's website.(adsbygoogle = window.adsbygoogle || []).push({});",Women in Aerospace Foundation Scholarship
0,600 Madison Ave,16th Floor,"New York, NY 10022-1615",info@churchillscholarship.org,,,https://www.scholarships.com/financial-aid/college-scholarships/scholarships-by-major/math-scholarships/winston-churchill-foundation-of-the-usa-scholarship-program/,"The prestigious Churchill Scholarship was set up at the request of Sir Winston Churchill in order to fulfill his vision of US-UK scientific exchange with the goal of advancing science and technology on both sides of the Atlantic, helping to ensure our future prosperity and security. An applicant for the Churchill Scholarship must be a citizen of the United States, either native born or naturalized, and must be a senior who is enrolled in one of the institutions participating in the scholarship program or a student who has graduated from one of those institutions within the past 12 months. Upon taking up the Churchill Scholarship, a Churchill Scholar must hold a bachelor's degree or an equivalent, and may not have attained a doctorate. Applicants should be able to show proven talent in research and a capacity to contribute to the advancement of knowledge in the sciences, engineering, or mathematics by pursuing original, creative work at an advanced level as demonstrated by awards, prizes, research, and letters of recommendation. Applicants in the sciences and engineering will demonstrate extensive laboratory experience, internships, or other related work, while applicants in mathematics will show substantial independent work or other projects. The Foundation does not require a minimum GPA, but recent Churchill Scholars have had a GPA of at least 3.7 and usually have 3.9 or above. For more information or to apply, please visit the scholarship provider's website.(adsbygoogle = window.adsbygoogle || []).push({});",Winston Churchill Foundation of the USA Scholarship Program
0,360 Woods Hole Road,,"Woods Hole, MA 02543",education@whoi.edu,,,https://www.scholarships.com/financial-aid/college-scholarships/scholarships-by-major/math-scholarships/whoi-summer-student-fellowship-program/,"Summer Student Fellowships at the Woods Hole Oceanographic Institution are awarded to undergraduate students who have completed their junior or senior year at colleges or universities and are studying in any of the fields of science or engineering including but not limited to the fields of biology, chemistry, engineering, geology, geophysics, mathematics, meteorology, physics, oceanography, and marine policy. Students must have at least a tentative interest in the ocean sciences, oceanographic engineering, mathematics, or marine policy. Persons from underrepresented groups are encouraged to apply.(adsbygoogle = window.adsbygoogle || []).push({});For more information or to apply, please visit the scholarship provider's website.",WHOI Summer Student Fellowship Program
0,1605 NW Sammamish Rd.,Suite 200,"Issaquah, WA 98027-5388",info@waopportunityscholarship.org,,,https://www.scholarships.com/financial-aid/college-scholarships/scholarships-by-major/math-scholarships/washington-state-opportunity-scholarship/,"The Washington State Opportunity Scholarship (WSOS) supports low- and middle-income students pursuing eligible high-demand majors in science, technology, engineering, math (STEM) or health care and encourages recipients to work in Washington state once they complete their degrees. Students must have a minimum 2.75 GPA and plan to enroll in an eligible Washington state college or university.(adsbygoogle = window.adsbygoogle || []).push({});For more information or to apply, please visit the scholarship provider's website.",Washington State Opportunity Scholarship
0,,,,,,,https://www.scholarships.com/financial-aid/college-scholarships/scholarships-by-major/math-scholarships/uw-stout-polytechnic-scholarship/,"Students are eligible for The Polytechnic Scholarship if they rank in the top 25% of their graduating class (3.5 GPA if your high school does not rank) and have a 24 or greater composite ACT score. Students must be enrolled freshmen year with a minimum of 12 credits (does not include advanced placement or transfer credits). Students are awarded a non-renewable scholarship. Students must be admitted by the first Monday in February and updated credentials must be received by the deadline. The scholarship is awarded upon acceptance into the program, there is no application form.(adsbygoogle = window.adsbygoogle || []).push({});For more information or to apply, please visit the scholarship provider's website.",UW Stout Polytechnic Scholarship
0,7178 Columbia Gateway Dr.,,"Columbia, MD 21046",scholarship@usra.edu,,,https://www.scholarships.com/financial-aid/college-scholarships/scholarships-by-major/math-scholarships/universities-space-research-association-usra-scholarship-awards/,"The USRA Scholarship Awards provide college scholarship awards to students who have shown a career interest in space science research, aeronautics-related sciences, or space science education. To be considered, applicants must be full-time undergraduate students attending a four-year accredited college or university that offers courses leading to a degree in science or engineering. Applicants must be within two years (juniors and seniors) of earning a bachelor's degree in a field of science or engineering, including science education, by the time the award is received. For a complete list of scholarships offered, more information or to apply, please visit the scholarship provider's website.(adsbygoogle = window.adsbygoogle || []).push({});",Universities Space Research Association (USRA) Scholarship Awards
0,3925 W Braker Ln,Suite 200,"Austin, TX 78759",scholarships@tsgc.utexas.edu,,,https://www.scholarships.com/financial-aid/college-scholarships/scholarships-by-major/math-scholarships/tsgc-columbia-crew-memorial-scholarships/,"Texas Space Grant Consortium and the Aviation and Space Foundation of Texas in partnership with the National Aeronautics and Space Administration  have established this scholarship program in memory of the Space Shuttle Columbia astronauts. These seven men and women paid the ultimate sacrifice to expand the exploration of space and our knowledge of the world that we live in.(adsbygoogle = window.adsbygoogle || []).push({});These scholarships are intended to recognize high-quality students and encourage their consideration of graduate studies in science, technology, engineering and mathematics fields which will ultimately lead to careers in space-related fields. The scholarships stress excellence in academics, participation in space education projects, participation in research projects and exhibited leadership qualities. Applicants must be citizens of the United States, registered as a full-time student at a TSGC member institution in good standing and also be a sophomore at a two-year institution, a junior or senior at a four-year institution or a first- or second-year student at a medical school. For more information or to apply, please visit the scholarship provider's website.",TSGC Columbia Crew Memorial Scholarships
0,8645 Founders Rd,,"Indianapolis, IN 46268-1393",tash@tkefoundation.org,,,https://www.scholarships.com/financial-aid/college-scholarships/scholarships-by-major/math-scholarships/tke-francis-j-flynn-memorial-scholarship/,"Frank J. Flynn was initiated a Teke at Theta-Sigma Chapter at St. John’s University in 1968, where he was a professor of mathematics. He served as Faculty Advisor, Chapter Advisor, and as the first District President (now Grand Province Advisor) for the Liberty District. He was a Grand Prytanis Key Leader Award recipient in 1975. Frater Flynn entered the Chapter Eternal in 1987, while in his second term on the Board of Directors of the TKE Educational Foundation. His wife, Mary, a staunch supporter of TKE, continued to fund the scholarship until her death.(adsbygoogle = window.adsbygoogle || []).push({});All of the TKE Educational Foundation leadership and scholarship awards are for the benefit of active members of Tau Kappa Epsilon Fraternity.This scholarship is awarded in recognition of academic achievement with a Grade Point Average of at least 2.75 or higher and recognizes outstanding leadership within the chapter. The applicant must be pursuing an undergraduate degree in mathematics or education. Preference will first be given to a member of Theta-Sigma Chapter, but if there is no qualified applicant, the scholarship will be open to any other qualified Teke.",TKE Francis J. Flynn Memorial Scholarship
0,216 West Jackson Blvd.,Suite 700,"Chicago, IL 60606",jvsscholarship@jvschicago.org,,,https://www.scholarships.com/financial-aid/college-scholarships/scholarships-by-major/math-scholarships/the-jewish-federation-of-metropolitan-chicago-academic-scholarship/,"Educational scholarship funds from grants administered by the Jewish Federation of Metropolitan Chicago are available for Jewish college and graduate students. Approximately $500,000 is available each year for full-time students, predominantly those legally domiciled in the metropolitan Chicago area, who are identified as having promise for significant contributions in their chosen careers. Assistance is available primarily for those with financial need who are pursuing careers in the helping professions.(adsbygoogle = window.adsbygoogle || []).push({});Eligibility:-Must be Jewish-Must have been born and raised in Chicago metropolitan area, including Lake County, Indiana; or one continuous year of full-time employment in the Chicago metro area prior to enrollment-Intend to remain in the Chicago metropolitan area after completing school-Are entering an accredited graduate program in a helping profession on a full-time basis for the full academic year-Are entering your junior or senior years of an accredited bachelor's degree program in a helping profession on a full-time basis for the full academic year-Demonstrate financial need-Demonstrate career promise-Are available for an in-person interview between March 1 and April 20For more information or to apply, please visit the scholarship provider's website.",The Jewish Federation of Metropolitan Chicago Academic Scholarship
0,1411 W. 190th Street,Suite 700,"Gardena , CA 90248",,,,https://www.scholarships.com/financial-aid/college-scholarships/scholarships-by-major/math-scholarships/the-hispanic-scholarship-fund-college-scholarships/,"HSF/ General College Scholarships are designed to assist students of Hispanic heritage in obtaining a college degree. Scholarships are available on a competitive basis to graduating high school seniors, community college transfer students, undergraduate students and graduate students. Applicants must be of Hispanic heritage and have a minimum of 3.0 GPA for high school students. A minimum of 2.5 GPA for college and graduate students. Plan to enroll full-time in an accredited not-for-profit, four-year university or graduate school during the fall of the scholarship cycle year. U.S. Citizen, permanent legal resident, DACA or eligible non-citizen. For more information or to apply, please visit the scholarship provider's website.(adsbygoogle = window.adsbygoogle || []).push({});",The Hispanic Scholarship Fund College Scholarships
0,301 Sparkman Drive,MSB 205,"Huntsville, AL 35899",spacegrant@uah.edu,,,https://www.scholarships.com/financial-aid/college-scholarships/scholarships-by-major/math-scholarships/teacher-education-scholarship-program-of-the-alabama-space-grant-consortium/,"The Alabama Space Grant Consortium (ASGC), a member of the NASA National Space Grant College and Fellowship Program, supports undergraduate scholarships and graduate fellowships for students studying in an aerospace-related discipline at participating universities and who have at least a 3.0 GPA.(adsbygoogle = window.adsbygoogle || []).push({});For more information or to apply, please visit the scholarship provider's website.",Teacher Education Scholarship Program of the Alabama Space Grant Consortium
0,,,,,,,https://www.scholarships.com/financial-aid/college-scholarships/scholarships-by-major/math-scholarships/teach-grant/,"The TEACH Grant Program provides grants to students who are completing or plan to complete course work needed to begin a career in teaching.(adsbygoogle = window.adsbygoogle || []).push({});To receive a TEACH Grant, you must:-Meet the basic eligibility criteria for the federal student aid programs-Complete the Free Application for Federal Student Aid (FAFSA)-Be enrolled as an undergraduate, post-baccalaureate, or graduate student at a school that participates in the TEACH Grant Program-Meet certain academic achievement requirements (generally, scoring above the 75th percentile on one or more portions of a college admissions test or maintaining a cumulative GPA of at least 3.25). For specific information about the academic requirements, talk to the financial aid office at your college or career school-Receive TEACH Grant counseling that explains the terms and conditions of the TEACH Grant service obligation. You must complete counseling each year that you receive a TEACH Grant-Sign a TEACH Grant Agreement to ServeAs a condition for receiving a TEACH Grant, you must sign a TEACH Grant Agreement to Serve in which you agree to (among other requirements) teach in a high-need field, at an elementary school, secondary school, or educational service agency that serves students from low-income families for at least four complete academic years within eight years after completing (or ceasing enrollment in) the course of study for which you received the grant.For more information or to apply, please visit the scholarship provider's website.",TEACH Grant
0,2625 Alcatraz Avenue,PMB 356,"Berkeley, CA 94705",g.oconnell@berkeley.edu,,,https://www.scholarships.com/financial-aid/college-scholarships/scholarships-by-major/math-scholarships/swe-golden-gate-section-scholarship/,"The Golden Gate Section of the Society of Women Engineers (SWE) is pleased to announce its High School Scholarship Program. Each year our Section awards scholarships to graduating local high school seniors who are pursuing a degree in engineering, computer science, physical science, or mathematics.(adsbygoogle = window.adsbygoogle || []).push({});Applicants must be females attending school within the boundaries of the Golden Gate Section (includes San Francisco, Marin, Napa, Sonoma, San Mateo counties and parts of Contra Costa and Alameda counties). See website for eligible zip codes. For more information or to apply, please visit the scholarship provider's website.",SWE Golden Gate Section Scholarship
0,475 N. Martingale Road,Suite 600,"Schaumburg, IL 60173",ttatsumi@soa.org,,,https://www.scholarships.com/financial-aid/college-scholarships/scholarships-by-major/math-scholarships/society-of-actuaries-hickman-scholar-program/,"The Society of Actuaries James C. Hickman Scholar program was established to increase the number of academic actuaries who hold a PhD and an actuarial designation, and who intend to pursue academic careers in the United States or Canada. The program is designed to provide stipends to doctoral students who will, through their studies, address research and education needs of the profession, including both the theoretical and practical aspects.(adsbygoogle = window.adsbygoogle || []).push({});Eligibility:- Enrolled full-time, have recently been admitted or are currently applying to a qualifying doctoral program (e.g. bustiness, demography, economics, financial economics, insurance, mathematics, risk management, statistics) in the United States or Canada- Applicants may apply at the same time they are applying for a doctoral program; if selected these applicants will be awarded the stipend conditional upon enrollment in a qualifying doctoral program- Hold a Fellowship-level actuarial credential or are pursuing Associateship or Fellowship membership of an accrediting actuarial organization (i.e. CAS, CIA, FA, IA, IAA, SOA)- Applicants who are already Associate members (including those awarded the CERA designation) will be expected to pursue a Fellowship credential- Must have at least two actuarial exams passedFor more information or to apply, please visit the scholarship provider's website.",Society of Actuaries Hickman Scholar Program
0,P.O. Box 3000,,"Boulder, CO 80307-3000",soars@ucar.edu,,,https://www.scholarships.com/financial-aid/college-scholarships/scholarships-by-major/math-scholarships/significant-opportunities-in-atmospheric-research-and-science-soars-program/,"SOARS encourages applications from individuals who are members of a group that is historically under-represented in the atmospheric and related sciences, including students who are Black or African American, American Indian or Alaska Native, and Hispanic or Latino, female, first-generation college students, and students with disabilities. SOARS welcomes lesbian, gay, bisexual, and transgender students; students who have experienced, and worked to overcome, educational or economic disadvantage and/or have personal or family circumstances that may complicate their continued progress in research careers.(adsbygoogle = window.adsbygoogle || []).push({});Eligibility:-Have completed the equivalent of two years of college-Have at least one semester of college remaining after the initial summer program-Have a cumulative 3.0 GPA or higher-Have a major in atmospheric science or a related field such as the geosciences, biology, chemistry, computer science, earth science, engineering, environmental science, mathematics, meteorology, oceanography, physics or social science-Plan to pursue a career in atmospheric or a related science-Have U.S.-citizen or permanent-resident status-Be comfortable with all internship requirementsFor more information or to apply, please visit the scholarship provider's website.",Significant Opportunities in Atmospheric Research and Science SOARS Program
0,,,,,,,https://www.scholarships.com/financial-aid/college-scholarships/scholarships-by-major/math-scholarships/shpe-professional-scholarship/,"SHPE will provide $2,000 to applicants who are employed full-time in the U.S. or Puerto Rico in a technical career field and enrolled at least half-time (6 hours) in a science, technology, engineering, or math (STEM) degree program and maintain a 3.0 GPA throughout the academic year. Applicant must be pursuing a first master's or doctoral degree. Applicant must be a paid SHPE member in good standing both at the time of application and throughout the academic year. The scholarship will be awarded on the basis of academic standing and financial need. For more information or to apply, please visit the scholarship provider's website.(adsbygoogle = window.adsbygoogle || []).push({});",SHPE Professional Scholarship
0,8801 South Yale,Suite 500,"Tulsa, OK 74137",scholarships@seg.org,,,https://www.scholarships.com/financial-aid/college-scholarships/scholarships-by-major/math-scholarships/seg-scholarships/,"Through the generosity of our donors, there are approximately 75 different scholarships. Half are unrestricted scholarships; the rest have specific donor intentions that include consideration for major/minor, university, career intention, involvement in student activities, year of study, or particular research field. Applicants must be either attending high school and planning to enter college next fall or be current undergraduate or graduate college students whose grades are above average. Students must intend to pursue a college curriculum directed toward a career in applied geophysics. For more information or to apply, please visit the scholarship provider's website.(adsbygoogle = window.adsbygoogle || []).push({});",SEG Scholarships
0,,,,,,,https://www.scholarships.com/financial-aid/college-scholarships/scholarships-by-major/math-scholarships/scarlett-family-foundation-scholarship/,"Scarlett Family Foundation Scholarships are open to high school seniors and college freshmen, sophomores, and juniors who will graduate or have graduated from high school in one of the following Middle Tennessee counties: Bedford, Cannon, Cheatham, Clay, Coffee, Cumberland, Davidson, Dekalb, Dickson, Fentress, Franklin, Giles, Hickman, Houston, Humphreys, Jackson, Lawrence, Lewis, Lincoln, Macon, Marshall, Maury, Montgomery, Moore, Overton, Perry, Pickett, Putnam, Robertson, Rutherford, Smith, Stewart, Sumner, Trousdale, Van Buren, Warren, Wayne, White, Williamson and Wilson.(adsbygoogle = window.adsbygoogle || []).push({});Scarlett Family Foundation scholarships are open to middle Tennessee high school seniors, who will graduate or obtain a GED prior to June 1st and to college freshman, sophomores and juniors.Applicants must demonstrate financial need and must be planning to pursue a business degree at a four-year, not-for-profit college. Must have a minimum GPA of 2.5 and must be pursuing a business or STEM approved degree at a 4 year, non-profit college or university, with the intent to enroll full-time in the fall. For more information and to apply, please visit the scholarship provider's website.",Scarlett Family Foundation Scholarship
