,contact_address1,contact_address2,contact_city_state_zip,contact_email,contact_phone,contact_title,details_url,program_description,program_name
0,P.O. Box 3228,212 Carnegie Center,"Princeton, NJ 08543",sapa_scholarship@yahoo.com,,,https://www.scholarships.com/financial-aid/college-scholarships/scholarships-by-major/math-scholarships/sapa-scholarship-and-excellence-in-education-program/,"The SAPA Scholarship and Excellence in Education Program (the ""SAPA Scholarship"") was established by the Sino-American Pharmaceutical Professionals Association (SAPA) in 1999. SAPA is a nonprofit tax-exempt professional organization headquartered in the tri-state (NJ-NY-CT) area and has become a major pharmaceutical professional organization with more than 4000 members and five Chapters in the U.S. and China. The primary purpose of SAPA Scholarship is to recognize and support educational excellence achieved by outstanding high school students, and to encourage the finest high school graduates to develop careers in life sciences.(adsbygoogle = window.adsbygoogle || []).push({});SAPA will award undergraduate scholarships to selected candidates, known as SAPA Scholars, for use during their college freshman year. The awards will be made on the basis of merits to those who have outstanding potential and intend to pursue careers in life sciences. The Scholarship is merit-based and open to national competition. Applicants for the SAPA Scholarship must include in their application materials a statement of interest in pursuing a career related to life sciences.To be considered for nomination as a SAPA Scholar, a student must:-Be a high school senior who is planning to attend a full-time undergraduate program at an accredited four-year college/university with a major related to life sciences-Have a minimum GPA of 3.3 and a minimum SAT score of 2000 or ACT score of 30-Be a United States citizen, or a legal resident alien (please submit a photocopy of the Alien Registration Card)For more information or to apply, please visit the scholarship provider's website.",SAPA Scholarship & Excellence in Education Program
0,751 W Fourth St,Suite 200,"Winston-Salem, NC 27101-2702",StudentAid@wsfoundation.org,,,https://www.scholarships.com/financial-aid/college-scholarships/scholarships-by-major/math-scholarships/sam-l-booke-sr-scholarship/,"The Sam L. Booke, Sr. Scholarship was established in 1989 in honor of  Sam L. Booke, Sr. to provide renewable scholarships to graduating high school seniors from the public high schools in the Winston-Salem/Forsyth County School system who will major in mathematics. This scholarship seeks to encourage outstanding students to pursue careers in(adsbygoogle = window.adsbygoogle || []).push({});the mathematics field. (Note: A ""mathematics degree"" is intended to include the study of  statistics and actuarial science, but does not include the study of  accounting, computer science, or engineering.) Scholarships will be applied to the cost of  undergraduate tuition, fees, room and board, and other college expenses.To receive consideration, applicants must:-Demonstrate excellence in mathematics in both course selection and grades-Pursue an undergraduate mathematics degree and demonstrate the potential to achieve the career goal to which he/she aspires-Demonstrate evidence of scholarship, including appropriate selection of high school curriculum and a ranking within the top 15% of their class-Demonstrate evidence that the student has already shown interest in and concern for being a contributingmember of societyFor more information or to apply, please visit the scholarship provider's website.","Sam L. Booke, Sr. Scholarship"
0,300 Seward Street,P.O. Box 248,"Ripon, WI 54971-0248",financialaid@ripon.edu,,,https://www.scholarships.com/financial-aid/college-scholarships/scholarships-by-major/math-scholarships/ripon-college-knop-science-scholars-program/,"The Knop Science Scholarship is a prestigious four-year, full tuition scholarship based on the next academic year's tuition figures. The Ripon College Knop Science Scholars Board convenes each year at the beginning of the second semester. The mission of the board is to identify high-achieving students who show the potential to contribute greatly to the science and mathematics departments at Ripon College as well as those who will benefit the most from special scholarly opportunities.(adsbygoogle = window.adsbygoogle || []).push({});The first step to being a qualified candidate for the Knop Scholarship is to attend one of our Pickard Scholarship Day competitions in February. The second step is to submit an essay of 750 words or fewer describing your background, experiences, interests and/or career goals in an area of the sciences or mathematics.For more information or to apply, please visit the scholarship provider's website.",Ripon College Knop Science Scholars Program
0,P.O. Box 91803,,"Pasadena, CA 91109",scholarships@noglstp.org,,,https://www.scholarships.com/financial-aid/college-scholarships/scholarships-by-major/math-scholarships/out-to-innovate-scholarships-for-lgbtqstem-students/,"NOGLSTP established the Out To Innovate Scholarships for LGBTQ STEM students which are intended for undergraduate and graduate students pursuing degrees in science, technology, engineering, or mathematics (STEM) programs who are either lesbian, gay, bisexual, transgender, queer or an active ally of the LGBTQ community. One scholarship will go to an undergraduate student, and one will go to a graduate/professional level student. Applicants must have successfully completed a minimum of two years of post-high school education at an accredited college or university, have a minimum 3.0 GPA, a declared major in an accredited STEM or STEM-related teaching field and be an active supporter of and participant in programs or organizations that promote LGBTQ inclusion and visibility. For more information or to apply, please visit the scholarship provider's website.(adsbygoogle = window.adsbygoogle || []).push({});",Out To Innovate Scholarships for LGBTQ+STEM Students
0,1400 Alhambra Circle,Suite 1400,"Coral Gables, FL 33134",info@odebrechtaward.com,,,https://www.scholarships.com/financial-aid/college-scholarships/scholarships-by-major/math-scholarships/odebrecht-award-for-sustainable-development/,"The Odebrecht Award for Sustainable Development is open to undergraduate and graduate students from accredited universities across the United States. Students must be enrolled full-time for the academic term in which the competition takes place. Projects may be undertaken individually or in a group of no more than three students under the supervision of an Advising Professor. If in a group, students must be enrolled at the same university and are encouraged to invite team members from other schools or departments within their institution. At least one student in the group must be pursuing a degree in engineering (all areas), architecture, building and construction management, or chemistry. For more information or to apply, please visit the scholarship provider's website.(adsbygoogle = window.adsbygoogle || []).push({});",Odebrecht Award for Sustainable Development
0,1818 N Street NW,Suite 500,"Washinton, DC 20036",info@nsfgradfellows.org,,,https://www.scholarships.com/financial-aid/college-scholarships/scholarships-by-major/math-scholarships/nsf-graduate-research-fellowship-program/,"The National Science Foundation's Graduate Research Fellowship Program helps ensure the vitality of the human resource base of science and engineering in the United States and reinforces its diversity. The prestigious program recognizes and supports outstanding graduate students in NSF-supported science, technology, engineering, and mathematics (STEM) disciplines who are pursuing research-based masters and doctoral degrees in the U.S. and abroad.(adsbygoogle = window.adsbygoogle || []).push({});NSF Fellows are expected to become knowledge experts who can contribute significantly to research, teaching, and innovations in science and engineering. These individuals will be crucial to maintaining and advancing the nation's technological infrastructure and national security as well as contributing to the economic well-being of society at large. So that the nation can build fully upon the strength and creativity of a diverse society, the Foundation welcomes applications from all qualified individuals and strongly encourages women, minorities, and persons with disabilities to compete fully in this program.Deadlines vary by field(s) of study.For more information or to apply, please visit the scholarship provider's website.",NSF Graduate Research Fellowship Program
0,Dept. of Education--Trinity University,One Trinity Place,"San Antonio, TX 78212-7200",creyes1@trinity.edu,,,https://www.scholarships.com/financial-aid/college-scholarships/scholarships-by-major/math-scholarships/noyce-teaching-fellowship-for-career-changers/,"The Robert Noyce Teaching Fellows program, authorized under the National Science Foundation Authorization Act, seeks to encourage talented science, technology, engineering, and mathematics (STEM) degree holders to become elementary, middle, and high school teachers by offering tuition assistance and salary stipends.(adsbygoogle = window.adsbygoogle || []).push({});Working professionals with an academic background in a STEM subject-area will be able to earn their Master of Arts in Teaching (M.A.T.) degree at Trinity and begin a fulfilling new career as a classroom teacher in one year.For more information, please visit our website.Over the next two years, ten Noyce Teaching Fellows will receive a full cost-of-attendance scholarship to attend our nationally-recognized, one-year teacher certification program. To minimize the financial cost of changing careers, Fellows will receive an additional stipend during their first four years in the profession.",Noyce Teaching Fellowship for Career Changers
0,"Space Studies Department, 5th Floor Clifford Hall",P.O. Box 9008,"Grand Forks, ND 58202-9008",msaad@space.edu,,,https://www.scholarships.com/financial-aid/college-scholarships/scholarships-by-major/math-scholarships/north-dakota-space-grant-consortium-undergraduate-scholarship/,"North Dakota Space Grant will continue to provide scholarship funding for outstanding students at North Dakota's public two- and four-year colleges and universities.(adsbygoogle = window.adsbygoogle || []).push({});Scholarships, which are designed for students pursuing STEM degrees that support NASA research and technology needs, are awarded for both the fall and spring semesters. NDSU/UND undergraduate students are not eligible for undergraduate scholarships.Eligibility:- Must be a citizen of the United States- Must have a minimum 3.0 GPA- Must be pursuing a degree in a STEM-related fieldFor more information or to apply, please visit the scholarship provider's website.",North Dakota Space Grant Consortium Undergraduate Scholarship
0,P.O. Box 60052,,"Shoreline, WA 98160-0052",nmcarman@aol.com,,,https://www.scholarships.com/financial-aid/college-scholarships/scholarships-by-major/math-scholarships/nellie-martin-carman-scholarship-fund/,"The Nellie Martin Carman Scholarship is available to graduating seniors from public high schools in King, Pierce, and Snohomish counties in Washington state. Application forms are only available through these high schools and candidates for the scholarship are nominated by their school each year. Scholarships are renewable for four years of college in the state of Washington. Music, sculpture, drawing, interior decorating or domestic science are not accepted as major subject courses. For more information and to apply, please visit the scholarship provider's website.(adsbygoogle = window.adsbygoogle || []).push({});",Nellie Martin Carman Scholarship Fund
0,204 E Street NE,,"Washington, DC 20002",scholarship@spaceclub.org,,,https://www.scholarships.com/financial-aid/college-scholarships/scholarships-by-major/math-scholarships/national-space-club-keynote-scholarships/,"Provided to a high school senior, undergraduate or graduate student with definite plans to pursue a career in the science, technology, engineering or mathematics (STEM) fields.(adsbygoogle = window.adsbygoogle || []).push({});Eligibility:-Must be a U.S. citizen-The scholarship is open to seniors in high school through graduate students-The applicant must have the intention of pursuing a career in the STEM fields and plan to attend an accredited U.S college or university to follow a course of study to pursue a career in the STEM field, with a preference for those with space related interests-The applicant can only use the $10,000 scholarship towards tuition for the coming academic year-The applicant must not have previously spoken at the Robert H. Goddard Memorial Dinner-The applicant may apply for any of the scholarships offered by the National Space Club (Robert H. Goddard Memorial Scholarship, Olin E Teague Scholarship, Keynote Scholarship) in the same year, but may only win one in the same yearIn addition:-Completed application and video must be uploaded to the National Space Club website-If chosen to continue, the recipient must be available to speak with the NSC executive committee for a live audition via Skype on January 6th-The recipient must be available to speak at the Goddard Memorial Dinner. Travel and lodging for the recipient and one guest will be provided by the National Space Club-Scholarship check will be provided to the college or university made payable to the applicable college or university no later than June 1st of next year-Non-recipients will not be notified. Applicants may check our website for announcement of the scholarship winnerFor more information or to apply, please visit the scholarship provider's website.",National Space Club Keynote Scholarships
0,1430 Duke Street,,"Alexandira, VA 22314",info@gemfellowship.org,,,https://www.scholarships.com/financial-aid/college-scholarships/scholarships-by-major/math-scholarships/national-gem-consortium-fellowships/,"GEM offers MS and Ph.D. level students an outstanding opportunity and access to dozens of the top engineering and science firms and Universities in the nation. The GEM Fellowship was designed to focus on promoting opportunities for individuals to enter the industry at the graduate level in areas such as research and development, product development, and other high-level technical careers. GEM also offers exposure opportunities to a number of opportunities in academe. GEM provides three fellowship programs: MS Engineering, Ph.D. Engineering and Ph.D. Science. For more information or to apply, please visit the scholarship provider's website.(adsbygoogle = window.adsbygoogle || []).push({});",National GEM Consortium Fellowships
0,181 N Street,NW Suite 600,"Washington, DC 20036",ndseg@asee.org,,,https://www.scholarships.com/financial-aid/college-scholarships/scholarships-by-major/math-scholarships/national-defense-science-and-engineering-graduate-fellowship/,"As a means of increasing the number of U.S. citizens and nationals trained in science and engineering disciplines of military importance, the Department of Defense plans to award approximately 180 new three-year graduate fellowships in April, subject to the availability of funds. The DoD will offer these prestigious fellowships to individuals who have demonstrated the ability and special aptitude for advanced training in science and engineering.(adsbygoogle = window.adsbygoogle || []).push({});DSEG Fellowships last for three (3) years and pay for full tuition and all mandatory fees, a monthly stipend, and up to $1,000 a year in medical insurance (this excludes dental and vision insurance).National Defense Science and Engineering Graduate Fellowships are awarded to applicants who will pursue a doctoral degree in, or closely related to, an area of DoD interest within one of the following disciplines:-Aeronautical and Astronautical Engineering-Biosciences-Chemical Engineering-Chemistry-Civil Engineering-Cognitive, Neural, and Behavioral Sciences-Computer and Computational Sciences-Electrical Engineering-Geosciences-Materials Science and Engineering-Mathematics-Mechanical Engineering-Naval Architecture and Ocean Engineering-Oceanography-PhysicsEligibility:-Completing senior year of undergraduate study before the upcoming fall-Have an undergraduate degree and have never enrolled in a graduate program-Are currently in the first year of overall graduate studies-Are currently in the second year of overall graduate studies-Are currently starting the third year of overall graduate studies in the upcoming fall-Are considered a part-time graduate student and have fewer than 30 semester hours (or 45 credit hours) completed before the upcoming fall semesterFor more information or to apply, please visit the provider's website.",National Defense Science & Engineering Graduate Fellowship
0,875 Perimeter Drive,MS 1026,"Moscow, ID 83844-1011",isgc@uidaho.edu,,,https://www.scholarships.com/financial-aid/college-scholarships/scholarships-by-major/math-scholarships/nasa-idaho-space-grant-scholarship/,"If you are pursuing a degree in science, technology, engineering, math, or science and math education you can apply to the NASA Idaho Space Grant Consortium. The awards are renewed annually based upon the completion of program requirements for a maximum of four academic years. You must also possess a current cumulative GPA of 2.75 or higher. For more details and to apply, please visit the scholarship provider's website.(adsbygoogle = window.adsbygoogle || []).push({});",NASA Idaho Space Grant Scholarship
0,107 Akerman Hall,110 Union St. SE,"Minneapolis, MN 55455-0153",mnsgc@umn.edu,,,https://www.scholarships.com/financial-aid/college-scholarships/scholarships-by-major/math-scholarships/minnesota-space-grant-consortium-scholarships-and-fellowships/,"Scholarships are for U.S. citizens who are enrolled full-time at one of the Affiliate Member MnSGC schools.  Applicants must be majoring in science, math, or engineering fields with an interest in working for NASA.(adsbygoogle = window.adsbygoogle || []).push({});A GPA of 3.5 is standard, but may vary with each school. Applicants must contact faculty representatives at their school for more information.The MnSGC is part of the national Space Grant College Fellowship Program supported by NASA and matching state funding in each state. There is a Space Grant office in each state. Application deadlines vary from campus to campus within the consortium, so contact the MnSGC faculty representative at your school (see MnSGC Affiliate Contact webpage) for more details. The U of MN - Twin Cities typically collects applications early in the spring semester, for awards to be used in the spring.For more information or to apply, please visit the scholarship provider's website.",Minnesota Space Grant Consortium Scholarships and Fellowships
0,Valley City State University,Financial Aid Office,"Valley City, ND 58072",,,,https://www.scholarships.com/financial-aid/college-scholarships/scholarships-by-major/math-scholarships/l-d-dusty-rhoades-and-josephine-wright-memorial-scholarship/,"Memorials and contributions from the Rhoades family established this endowed scholarship fund. One scholarship is awarded annually to a student who had declared a Science or Music major/minor. Additional criteria include cumulative GPA and financial need. The award alternates each year between Science/Music.(adsbygoogle = window.adsbygoogle || []).push({});For more information or to apply, please visit the scholarship provider's website.","L.D. ""Dusty"" Rhoades and Josephine Wright Memorial Scholarship"
0,JSU Student Financial Aid Office,700 Pelham Road-North,"Jacksonville, AL 36265-1602",scholarships@jsu.edu,,,https://www.scholarships.com/financial-aid/college-scholarships/scholarships-by-major/math-scholarships/jsu-alabama-bush-memorial-scholarship/,"The JSU Alabama Bush Memorial Scholarship was established in memory of Newbern Bush, a retired faculty member who taught Mathematics.(adsbygoogle = window.adsbygoogle || []).push({});The Scholarship is to be awarded to a full-time native-born Alabama student who has attained Junior status and is majoring in Mathematics.For more information about this award, please visit our website.",JSU Alabama Bush Memorial Scholarship
0,930 E. 50th Street,,"Chicago , IL 60615",mchambers@rainbowpush.org,,,https://www.scholarships.com/financial-aid/college-scholarships/scholarships-by-major/math-scholarships/jesse-l-jackson-fellows-toyota-scholarship/,"The Jesse Jackson Fellows-Toyota Scholarship is a renewable scholarship that awards up to $25,000 dollars annually to deserving African-American college sophomores. Students who are interested in applying for the scholarship must have a minimum cumulative 3.0 GPA, be a business or STEM (Science, technology, engineering and/or math) major that can be applied to the automotive industry, demonstrated participation in community service and need for financial assistance. For more information or to apply, please visit the scholarship provider's website.(adsbygoogle = window.adsbygoogle || []).push({});",Jesse L. Jackson-Fellows Toyota Scholarship
0,4427 N. Clark St,,"Chicago , IL 60640",rmartinez@jasc-chicago.org,,,https://www.scholarships.com/financial-aid/college-scholarships/scholarships-by-major/math-scholarships/jasc-nielsen-stem-scholarship/,"In recognition of the community's achievements and its enduring values, Nielsen supports the next generation of Asian American leaders in science, technology, engineering, and mathematics (STEM) with these two scholarships.(adsbygoogle = window.adsbygoogle || []).push({});Eligibility:-Applicant must be either a high school senior or currently enrolled as a student in a college or university-Area of college study must be in either science, technology, engineering or mathematics (STEM)-High school applicant's family must have a current JASC Family membership. College applicant must have his/her own current student or individual membership-Applicant need not be of Japanese ancestry and need not be a citizen of the U.S.-Applicant must be a resident of the State of Illinois for at least one year prior to graduation or be a graduate from an accredited Illinois high school-Applicant must submit a written applicationRequired materials:-Official high school/college transcripts-Summary of extracurricular activities-Summary of community service-One page essay on one of the topics (choose one): ""How is JASC relevant to your life?"" or ""How has JASC contributed to your sense of self or personal growth?-Teacher/professor letter of reference-Japanese-American community participation letter of referenceCriteria:-Service to and participation in JASC and other Japanese American community events, programs, and projects-Good grades or steady improvement of grades over the course of high school-Demonstration of extracurricular activitiesFor more information or to apply, please visit the scholarship provider's website.",JASC-Nielsen STEM Scholarship
0,P.O. Box 82563,,"Hapeville, GA 30354",scholarship@freemontfoundation.com,,,https://www.scholarships.com/financial-aid/college-scholarships/scholarships-by-major/math-scholarships/james-m-and-erma-t-freemont-scholarship-program/,"The Freemont Foundation Scholarship Program is available to graduating high school seniors, undergraduate, and graduate students. Selected from a nationwide pool of applicants, qualified recipients will become Freemont Scholars.(adsbygoogle = window.adsbygoogle || []).push({});Eligibility:- Must be a graduating high school senior (must plan on attending a HBCU) or an undergraduate students (must currently attend a HBCU); graduate students are eligible to applyFor more information or to apply, please visit the scholarship provider's website.",James M. & Erma T. Freemont Scholarship Program
0,3900 Whiteside St.,,"Los Angeles, CA 90063",gcruz@greatmindsinstem.org,,,https://www.scholarships.com/financial-aid/college-scholarships/scholarships-by-major/math-scholarships/henaac-scholars-program/,"HENAAC scholarship recipients continue to pave the way for future generations of Hispanics and lead by example to empower our communities and enhance our nation’s professional technical workforce. In order to apply for the scholarship, applicants must demonstrate merit through academic achievements, leadership and campus/community activities; have a minimum 3.0 GPA; be pursuing a STEM-related degree and be of Hispanic origin and/or must significantly demonstrate leadership or service within the Hispanic community. For more information or to apply, please visit the scholarship provider's website.(adsbygoogle = window.adsbygoogle || []).push({});",HENAAC Scholars Program
0,Attention: Award Nominations,732 N. Washington Street,"Alexandria, VA 22314",pamela@amstat.org,,,https://www.scholarships.com/financial-aid/college-scholarships/scholarships-by-major/math-scholarships/gertrude-m-cox-scholarship/,"The Gertrude M. Cox Scholarship was established in 1989 to encourage more women to enter statistically oriented professions. Application is limited to women who are citizens or permanent residents of the United States or Canada and who are admitted to full-time study in a graduate statistics program (includes biostatistics and other statistical sciences) by July of the award year. Women in or entering the early stages of graduate training (MS or PhD) are especially encouraged to apply.(adsbygoogle = window.adsbygoogle || []).push({});For more information or to apply, please visit the scholarship provider's website.",Gertrude M. Cox Scholarship
